"Street_Number","ML_Number","Street_Name","City","State","Zip_Code","Selling_Price","Listing_Price","MLS","DOM","CDOM","Ownership","Financing","CC","Contingent_Date","Pending_Date","Selling_Date","Style","Age","ROOM","BELL","MNFL","MNHF","UPFL","UPHF","Square_Footage","Basement_Square_Footage","BSMT","LOWR","LWFL","LWHF","HEAT","HETS","COOL","GRG_No","CRP_No","PRKD","MISC","KITC","LTDS","FRP_No","FPLD","FRPL" 
"9047","12034603","Coral","St Louis","MO","63123","","145000.00","GSTL","30","30","Private","","","","","","Ranch","72","6","2","1","0","0","0","1084","","Partial","0","0","0","Forced Air","Gas","Ceiling Fan, Central-Electric","1","0","Attached Garage","Deck, Smoke Alarm/Detec","","Cul-De-Sac","1","Woodburning Fireplce","Living Room"
"9030","12024091","Coral","St Louis","MO","63123","","159900.00","GSTL","78","78","Private","","","","","","Ranch","71","6","2","1","0","0","0","1328","","Full, Partially Finished","0","0","0","Forced Air","Gas","Ceiling Fan, Central-Electric","1","0","Attached Garage, Garage Door Opener","High Spd Connection, Smoke Alarm/Detec, Utility Shed","Custom Cabinetry, SolidSurfaceCounter","Corner Lot, Fencing, Level Lot, Sidewalks","1","Full Masonry, Woodburning Fireplce","Living Room"
"9411","11055188","Daisy","St Louis","MO","63123","110000.00","114900.00","GSTL","117","117","Private","Conventional","0","3/9/2012 12:00:00 AM","3/12/2012 12:00:00 AM","5/8/2012 12:00:00 AM","Bungalow / Cottage","73","6","2","1","0","0","0","1152","","Bathroom in LL, Full, Walk-Out","0","1","0","Baseboard, Forced Air","Gas","Ceiling Fan, Central-Electric","1","0","Detached, Garage Door Opener","Deck, Home Protection Plcy","Custom Cabinetry, Eat-In Kitchen, Updated Kitchen","Level Lot","0","None","None"
"9209","12017982","Coral","St Louis","MO","63123","140000.00","144900.00","GSTL","30","30","Private","FHA","0","","4/20/2012 12:00:00 AM","5/23/2012 12:00:00 AM","Bungalow / Cottage","67","6","2","1","0","0","0","1393","","Full, Walk-Out","0","1","0","Forced Air","Gas","Ceiling Fan, Central-Electric","1","0","Attached Garage, Basement/Tuck-Under, Garage Door Opener","Deck, Home Protection Plcy, Smoke Alarm/Detec","Eat-In Kitchen, Pantry","Backs to Trees/Woods, Level Lot, Partial Fencing","1","Woodburning Fireplce","Living Room"
"9044","11055763","Kathleen","St Louis","MO","63123","98000.00","109900.00","GSTL","162","162","Private","Conventional","0","2/21/2012 12:00:00 AM","4/6/2012 12:00:00 AM","5/7/2012 12:00:00 AM","Bungalow / Cottage","72","5","2","1","0","0","0","1100","","Full","0","0","0","Forced Air","Gas","Central-Electric","1","0","Additional Parking, Detached, Garage Door Opener, Off Street","Near Public Trans","Eat-In Kitchen","Fencing, Streetlights","0","None","None"
"9511","12012618","Sophine","St Louis","MO","63123","110000.00","120000.00","GSTL","14","14","Private","FHA","3000","","3/17/2012 12:00:00 AM","4/23/2012 12:00:00 AM","Ranch","56","5","2","1","0","0","0","940","","Full, Poured Concrete","0","0","0","Forced Air, Humidifier","Gas","Attic Fan, Ceiling Fan, Central-Electric","1","0","Additional Parking, Attached Garage, Off Street","Patio, Smoke Alarm/Detec","Eat-In Kitchen, Pantry","Fencing, Level Lot","0","",""
